{
  "run_label": "good-fixture",
  "terrain_shape": "The dag skill is a prose-instructed orchestrator; rules live as prose, not checks.",
  "elements": [
    { "element": "templates/*.md", "role": "artifact skeletons", "relevance": "become JSON schemas",
      "authority": "the template files" },
    { "element": "init_run.sh", "role": "seeds ledgers", "relevance": "seam to seed schemas+validator",
      "authority": "init_run.sh" }
  ],
  "invariants": ["verifier independence", "ledger is truth", "DAG acyclic", "loop bound <= 2"],
  "risks": ["over-formalization breaks usability", "formal theater"],
  "unknowns": ["whether Claude Code hooks can auto-run validators"]
}
